{
  "schema_version": 1,
  "project": "BookCast",
  "current_phase": "phase-19",
  "current_task": "Git Secret History Cleanup：干净本地分支已重建并验证，Phase19.3B真实实验暂停",
  "task_status": "completed",
  "branch": "codex/phase19-clean-history",
  "last_verified_commit": "18d86c2e682393eff4205d7f4c426a69832aa678",
  "completed_tasks": [
    "检查空目录并初始化 main 分支 Git 仓库",
    "建立统一 Agent 入口、领域术语、产品范围、架构规划和分阶段路线图",
    "实现版本化 STATE 契约和离线校验器，20 项回归测试通过",
    "完成文档交叉审阅并修正状态契约与生成任务定义的两处歧义",
    "抽查本地书籍、生成音频和凭证的 Git 忽略规则",
    "创建并验证首个基础提交，完成 Phase 0 交接快照",
    "实现 EPUB/PDF/TXT 解析、Mock Provider、章节级可恢复流水线、CLI 和 MP3 输出，并完成工作区验证",
    "创建并验证 Phase 1 功能提交 (9e6e5aa)，实现本地电子书导入与 Mock 播客生成闭环",
    "实现统一 Provider API、可扩展 Registry、兼容 HTTP/local LLM、Mock 与 TOML 配置",
    "实现受控 failover、manifest v2 调用审计、最小任务恢复及 v1 原样备份迁移",
    "完整测试 78 passed，验证第七章接管、强制退出恢复及永久错误停止",
    "创建并验证 Phase 2 功能提交 2f06b01；完整测试 78 passed，项目校验和编译通过",
    "实现 BookIdentity、Source Registry、官方 CSV/RDF 来源与用户 URL/文件入口",
    "实现限量 HTTPS、MIME/容器验证、公网 IP 固定、逐获取阶段检查点及 Pipeline 元数据桥接",
    "Phase 3 全量离线测试 160 passed；真实目录返回国富论两个候选，拒绝静默选择",
    "真实国富论 gutenberg:3300 获取并解析 67 个文本段；源文件 2468951 字节，重复获取全部产物和检查点不变",
    "创建并验证 Phase 3 功能提交 9bdf53c；160 项测试、文档校验和提交检查通过，完成交接快照",
    "实现 Phase 4 九类证据分析、长章分块、章节/全书综合树与全局预算规划",
    "实现 summary/deep_read/two_host、上下文连续写作、逐段一致性复核、质量门禁和定向片段修订",
    "Phase 4 全量工作区测试 187 passed；三章中文 demo 覆盖100%、重复率4.93%、Host B占比27.47%，恢复无新增调用",
    "创建并验证 Phase 4 功能提交 d0bfde2；187项测试、10个子测试、编译、项目校验与提交检查通过",
    "实现 manifest v3 的 Job/Step/Artifact/Attempt、六态投影、持锁恢复与配置/来源快照",
    "实现 jobs/status/resume/retry/doctor 与进度日志；17项新增任务测试通过，含三处真实SIGKILL、额度接管、缓存与旧任务迁移",
    "Phase 5 全量204项测试和10个子测试通过；实际CLI demo完成27步骤/16调用，resume/retry后32文件字节与mtime不变",
    "创建并验证 Phase 5 功能提交 c05af03；204项测试、10个子测试、编译、项目校验与提交检查通过",
    "Phase 6 开始前核验 Phase 5 基线：204项测试和10个子测试通过，main干净且与origin/main同步",
    "新增 skills/bookcast/SKILL.md：意图/模式/预算、合法来源、命令、状态、失败恢复和结果反馈；无实现脚本",
    "19项Skill测试通过：文档命令实际CLI解析、三模式Core委托、版本/版权/永久失败门禁及无Skill独立运行",
    "Phase 6 工作区全量223项测试和10个子测试通过；Skill格式、编译、项目校验与Core无差异检查通过",
    "创建并验证 Phase 6 功能提交 0175f44；223项测试和10个子测试、Skill格式、编译、项目/提交校验通过，Core完全未变",
    "Phase 7 接手 main=892eb61 且与 origin/main 同步；223项基线和10个子测试通过",
    "实现 FastAPI/Next.js 同源本地客户端、持久化提交与独立worker，解析/获取/生成/恢复继续委托Core",
    "Web覆盖上传、候选确认、三种模式、预算、进度、Provider、历史、音频播放与恢复；完成Tauri评估",
    "13项API测试覆盖Core委托、上传边界、幂等/容量、Range、失败恢复和真实SIGKILL；3项Playwright E2E通过且已查看桌面/移动截图",
    "最终工作区236项测试和10个子测试通过；13项API、3项浏览器、构建、类型、编译与项目校验通过",
    "创建并验证Phase 7功能提交82c49da：236项测试、10个子测试、3项浏览器E2E、build/typecheck/compile及项目校验通过",
    "通过本地API生成自制BookCast-demo：3章、27步骤、16次AI调用、184077字节Mock MP3；数据保存在忽略的data/web",
    "Phase 8 接入Kokoro/sherpa-onnx CPU中文双音色、可选依赖、显式模型安装与完整性检查",
    "实现Core逐语音单元任务/缓存/审计及CLI/Web音频类型与实际时长反馈",
    "真实中文三章demo完成：24次TTS、276.429秒MP3；resume后83个文件字节/mtime不变且无新增调用",
    "Phase 8工作区全量262项测试和10个子测试通过，25项TTS/14项Web专项及3项浏览器E2E通过",
    "创建并验证Phase 8功能提交54c05ad：262项测试/10子测试、3项浏览器、构建/类型/编译/项目校验通过；提交上实际中文合成与83文件无变化恢复再次通过",
    "Phase 9接手核实HEAD与origin/main均4137d85，修正旧未push描述；关键基线86项通过",
    "复用兼容LLM实现强类型thinking/effort/token预算、中央任务策略、有效配置缓存与可选usage审计；无厂商SDK",
    "新增51项离线专项，完整313项测试和10子测试通过；真实LLM测试显式env开关默认跳过",
    "实际DeepSeek官方models无效凭证探测返回401并正确分类；有效生成尚未执行，未保存服务错误正文",
    "创建并验证功能提交ff3c48a：313项测试、10子测试、1联网测试跳过；项目校验/compileall/提交差异通过。Phase 9真实验收仍缺凭证",
    "用户复制凭证后安全注入环境；真实DeepSeek/Kokoro doctor可用，未输出或提交Key",
    "真实分析暴露字符偏移错误；以EvidenceAnalysis选择证据ID、Core精确查表修复，保留严格校验和失败历史，分析提示content-analysis-v3",
    "自制三章正式demo的13次DeepSeek调用首次成功，无Mock回退；分层分析/综合/脚本/一致性检查全部落盘",
    "Kokoro 0.8语速正式MP3完成：320.283秒、3844557字节；23个语音单元，调速前后LLM记录未变",
    "正式任务禁HTTP/TTS恢复通过：81文件SHA/mtime和59条历史调用完全不变；临时副本改thinking后保留分析、仅首个章节综合请求失效",
    "工作区专项142 passed；全量318 passed/10子测试/1联网跳过；已恢复真实测试任务显式复验1 passed，无新增调用",
    "真实用量记录：正式13调用input16422/output24445，48次总尝试input56285/output79397；null保留未知，未估算账单",
    "逐段文本审读：三章覆盖、真实问答与假设反例；保留2项来源归属警告，未声称真人试听或优秀内容质量",
    "创建并验证真实验收修复提交17fc1f1f9bac7f31aa1f9ab4c539fa625811421a：318项/10子测试通过，静态检查与正式81文件无网络恢复再次通过；按D-006保存交接快照，未push",
    "Phase 10：中立双模式TTS、显式云端Gemini Adapter、600字符/24发言片段及D-014缓存，Kokoro实现未修改",
    "Phase 10：真实同脚本Kokoro/Gemini MP3分别320.267208/251.440秒，新增LLM调用为0；Gemini3段成功、1次schema失败经受控显式重试恢复",
    "Phase 10：第6段额度接管、真实SIGKILL、单段损坏修复及旧任务兼容测试；两份真实任务禁Provider恢复83/43文件不变",
    "创建并验证Phase 10功能提交8761c3911b5e9e43d272671b4b613c1f2c67b0dd：完整367项/10子测试及真实任务禁HTTP恢复通过；按D-006保存最终交接，未push",
    "Phase 11核验Qwen/CosyVoice官方源码/模型/许可/设备路径，仅安装Qwen官方固定权重，两个safetensors SHA通过；Core未改",
    "Qwen FP32/eager五类中文真实生成全部完成：91.36秒音频，392.63秒生成，加权RTF4.30；两声线、207字长段、中英、日期数字WAV完整解码通过，未人工听校",
    "创建研究/spike阶段提交6902999b2a0e4183fbce54d59058e759ae3fe41a，不push",
    "BF16/SDPA五类中文实际生成通过：83.52秒音频/237.36秒生成，加权RTF2.84；只允许可选实验接入，不推荐quality默认",
    "接入qwen-local可选Adapter、显式实验类型配置、固定全资产校验、MPS/voice/style/seed缓存；13项专项及121项旧TTS/Provider回归通过",
    "真实同脚本Qwen任务第7单元RUNNING时SIGKILL退出137；恢复只重新开始第7，前6个WAV和sidecar SHA/mtime/大小未变；默认安装dry-run无Torch或Kokoro依赖改动",
    "Qwen真实同脚本MP3完成385.040秒/23单元，新增LLM请求0；三方脚本SHA一致，原13条LLM审计未变",
    "完成后禁模型加载/TTS/LLM/HTTP恢复84文件SHA/mtime不变；Kokoro83/Gemini43历史文件恢复不变",
    "最终完整离线380 passed/10子测试/3默认跳过；真实本地禁推理恢复1 passed，静态与183文件秘密字面值扫描通过",
    "创建并验证Phase 11功能提交64e344027d9e1f9cfddfde13dc99a784ddf5ba65：380测试/10子测试通过，3默认跳过；真实本地零调用恢复1 passed，validator/compileall/提交diff通过，未push",
    "Phase 12：建立可重复三方盲听协议和评分模板，真实试听尚未发生；Qwen继续experimental",
    "Phase 12：原子写临时文件增加BookCast专属标记，Job锁内恢复清理；manifest绑定的旧式0字节TTS unit temp安全清理，不改Artifact/缓存",
    "Phase 12：真实SIGKILL/临时文件专项3通过；已完成Kokoro/Gemini/Qwen任务禁synthesis/HTTP/LLM恢复各1通过",
    "创建并验证Phase 12功能提交7e71a2b8a24e678a93ac7d29ed8049f34d5faab5：完整381测试/10子测试通过，项目校验、compileall、提交diff及三Provider真实零调用恢复均通过；未推送",
    "Phase 13：独立完成Job音频→AAC/M4B导出，实际章节时间、节目/原书章节区分、受限封面及哈希缓存，CLI/Web按现存有效产物下载；无新增LLM/TTS调用",
    "Phase 13功能提交ed479cd3eea1e1dc87da7ea71e65390325b73294已验证：390项pytest通过、4项显式跳过、10子测试通过；3项浏览器E2E、Web build/typecheck、validator、compileall和提交diff通过",
    "Phase 14：固定无密钥首次配置方案、doctor --human、Web安全状态摘要和README顶部Quick Start；未改Provider Core或默认Mock",
    "隔离克隆Python 3.12正常安装Web依赖，setup demo→doctor→自制TXT Mock生成106893字节MP3通过；真实API未调用",
    "Phase 14功能提交c33a2b27da97a1658e345669dedc6a705a7c7943已验证：393项pytest通过、4项显式跳过、10子测试；3项浏览器E2E、Web构建通过",
    "建立 GitHub Actions Python Core / Web / Static validation 三个 job；PR 默认不调用收费 API、不下载 Qwen 大模型，含 lock、compile、validator、Mock MP3/M4B ffprobe 冒烟。",
    "pytest 默认只收 unit/integration 标记；live、large_model、manual_listening 单独登记，新增测试模块若未分类即阻止收集。",
    "使用临时全新 Git 克隆创建新虚拟环境并安装锁定 Python 与 npm 依赖；doctor、Mock 生成、MP3/M4B、Web build、project validator 均通过。",
    "使用经官方 Gutenberg 元数据和原始 SHA 重新核验的美国公有领域《国富论》副本完成 67 章 Mock pipeline；1507 Step、20 个 M4B 节目章节，completed resume 新增 0 字节。",
    "完整书运行发现 Mock 在纯标点分析块产生永久业务错误；content_mock 跳过无词项并用安全占位证据处理，新增回归测试，断点恢复后全书生成通过。",
    "创建第三方许可兼容说明和逐项 verified/manual/optional/blocked 发布检查表；未选择 BookCast LICENSE，保持版本 0.1.0 / pre-1.0。",
    "Phase 15功能提交验证完成：ec1ad6f；完整离线pytest 394 passed/5显式测试deselected/10 subtests，clean clone、Web、Mock MP3/M4B、全书Mock恢复、静态检查通过；项目保持0.1.0/pre-1.0，许可证与远端Actions运行留作人工发布门禁。",
    "Phase 16全仓审计确认Critical 0、High 3；直接生成绕过来源校验、Kokoro可伪造收据、Qwen可加载未固定文件均以最小补丁和反例回归修复。",
    "Phase 16审计记录Medium 7、Low 2与许可证/第三方资产发布阻塞；官方npm核心审计0，uv非Qwen依赖0，实验Qwen extra锁定依赖14条公告另列门槛。",
    "Phase 16功能提交acecfbfc336112d2a3fc226cd3ed334a6bfc0fa4验证：完整离线398 passed/5 deselected/10 subtests，Web typecheck/build/3项Playwright、project validator、compileall、lock/diff通过；无AI调用、模型推理或下载。",
    "Phase 17：按页检测text/image/mixed/blank，仅显式--ocr auto调用隔离Apple Vision识别PDF扫描区域和EPUB内嵌图片；不改内容/语音/导出链路。",
    "OCR源文本块保存源SHA、页/资源、区域、置信度和低置信warning；parse指纹含OCR模式/适配器版本，完成任务resume复用。",
    "Phase 17完整离线410 passed/1 skipped/5 deselected/10 subtests；真实本机Apple Vision中文、英文、90度页及隔离进程1 passed，无云API和模型下载。",
    "DeepSeek schema_error 诊断：本地两份《狂人日记》EPUB Job 均在 analysis:0004:0001 失败；收到响应及 usage，但历史原始响应和校验异常未保存，当前环境无 DeepSeek key，不能还原历史具体坏字段。已在适配器强化 DeepSeek JSON schema 指令，保留严格校验；Attempt/events 保存安全错误类型/字段/原因，显式 retry 回归保留前章。",
    "核对data/web/jobs六份Web记录：三份SUCCEEDED正常，三份《狂人日记》FAILED_PERMANENT均有合法submission/manifest/schema v3与有效源路径；旧Web进程因新增Attempt诊断字段触发extra_forbidden，误报记录损坏。新代码保留诊断到events，停止在manifest v3写入新字段；未修改任何任务数据。",
    "核对20分钟《狂人日记》Web Job 的原始settings和manifest snapshot均为deepseek→kokoro，TTS attempts/audio均为0；页面显示的48秒mock-tts来自另一份PDF Mock已完成任务。修复前端选中任务缺席时错误展示首条任务，真实TTS链禁止Mock混入，TTS缓存换Provider后失效，完成与只读状态需验证真实来源。",
    "读取3a591bfd Web Job 最近真实失败事件：analysis:0003:0001 的 DeepSeek ValidationError core_ideas too_long，前一次 evidence too_long；两者均超出 EvidenceAnalysis 每类最多6项。DeepSeek JSON mode 仅保证JSON语法。适配器明确列表上限，并在此类错误时同一Provider最多一次独立记账纠错调用；保留严格校验和已完成章节缓存。离线相关147 passed/1 deselected；本进程无DeepSeek key，尚未真实复验第3、4章。",
    "真实 DeepSeek 凭证环境验证《狂人日记》现存任务：第3章首块（analysis:0003:0001）成功通过；次块（analysis:0003:0002）初次调用因 evidence 超限触发重试，重试时 DeepSeek 修复 evidence 但 core_ideas 随机超限（7项），因适配器未做安全截断导致二次调用失败。在适配器补齐纠错轮次对未被针对警告的次级数组属性的有界安全截断（上限6项），保留严格域校验与首轮失败审计。真实复验第3章两块与综合、第4章一块与综合全部成功，连续两章通过后安全中断；相关测试 148 passed、1 deselected。",
    "真实 DeepSeek content synthesis 跨块 claim_ids 归约 business_error 修复：第30章归约因外推claim_ids超出allowed集合报business_error，在content层通过resolve_synthesis清洗有效子集，保持严格业务不变式且已有157步指纹不变。回归测试通过，真实API复验synthesis/chapters/0030/00-0001及后续00-0002均成功，累计完成159步后安全暂停。",
    "真实 DeepSeek chapter analysis 通用有界 schema 纠错与第 43～45 章有界验证：消除此前仅对 too_long 特判纠错的架构缺陷，实现通用 schema 纠错提示引导与有界单次模型 repair；增加可选数组 null 安全归一化与单元素提升。真实 API 复验第 43、44、45 连续三章（共 11 个 steps 全部成功，含第 45 章实测命中 schema 漂移并经单次纠错自动恢复成功），累计完成 246 步有界验证通过。",
    "实现 quality gate 矛盾/待核验发言局部定向修复（targeted repair）：当 quality gate 发现一致性 review 存在 contradicted 时，精确定位受影响 segment 及 turn_index，仅改写受影响段落并注入原引用证据及争议上下文；仅对修复段重跑 consistency review 并重新评估 quality；每个 segment 严格限制最多 2 次修复防止死循环；离线测试 157 passed / 1 deselected 验证 targeted repair、持久化 cache hit 与有界上限止损。",
    "EPUB来源过滤在Chapter/LLM前排除确定性封面/目录/广告及正文推广段落，source_filter.json审计保留和移除单元；quality-v2脚本推广门禁在TTS前阻断，未改变targeted repair。真实源只读核对旧72个XHTML单元/96分析chunk，净化后69/93；未调用DeepSeek或改动已完成Job。功能提交a65f77d经相关113 passed/1 skipped、validator/compileall/diff复验。",